{
  "$schema": "./memory-state-substrate-contracts.schema.json",
  "schema_version": "1.0.0",
  "contract_version": "0.3",
  "generated_at": "2026-06-18T12:54:58Z",
  "generated_by": {
    "agent_name": "Coastal Navigating Beacon",
    "platform": "claude-code",
    "model": "opus-4-8",
    "session_id_prefix": "d6adc0"
  },
  "human_contract": ".agent/memory/executive/memory-state-substrate-contracts.md",
  "doctrine": {
    "substrate_contracts": ".agent/practice-core/decision-records/PDR-050-state-memory-substrate-contracts.md",
    "merge_semantics": ".agent/practice-core/decision-records/PDR-049-memory-and-state-file-merge-semantics.md"
  },
  "strict_data_status": "strict-local-instance; the pure practice-substrate evaluator (agent-tools/src/practice-substrate) consumes this manifest and validates it against the adjacent schema. The live .agent/state/collaboration/ plane and several memory surfaces are Phase-8 / named-position forward-references not yet materialised in castr (see the human contract Current Materialisation section); their contract rows describe the intended shape.",
  "doctor_start_gate": "castr has no separate substrate-doctor workstream; the consumer is the pure practice-substrate evaluator (pnpm --filter @engraph/agent-tools practice-substrate -- check --mode report). Live collaboration-plane checks only become meaningful once the Phase-8 .agent/state/collaboration/ runtime data plane is materialised (the five collaboration JSON schemas already live in committed source at agent-tools/src/collaboration-state/schemas/ as of WS7, decoupled from the data path); until then the evaluator truthfully reports the absent data plane and that signal must not be silenced.",
  "portability_tiers": [
    "core-portable",
    "host-bridge",
    "repo-local-contract",
    "repo-local-implementation",
    "historical-evidence"
  ],
  "discovery": {
    "live_roots": [".agent/state/", ".agent/memory/"],
    "doctrine_roots": [
      ".agent/practice-core/decision-records/PDR-049-memory-and-state-file-merge-semantics.md",
      ".agent/practice-core/decision-records/PDR-050-state-memory-substrate-contracts.md"
    ],
    "plan_roots": [".agent/plans/transplant/06-memory-and-generator-consolidation.md"],
    "historical_roots": [".agent/memory/active/archive/"],
    "fixture_roots": ["agent-tools/tests/collaboration-state/"],
    "generated_read_models": [
      {
        "output": ".agent/state/collaboration/shared-comms-log.md",
        "source": ".agent/state/collaboration/comms/",
        "renderer": "pnpm agent-tools:collaboration-state -- comms render",
        "current_checker": "practice-substrate evaluateSharedCommsLog regenerates from the canonical events and compares once the Phase-8 .agent/state/collaboration/comms/ root is materialised"
      }
    ],
    "exclusions": [
      {
        "pattern": ".agent/state/collaboration/conversations/*.example.json",
        "reason": "Example fixtures inside the live directory; parse as examples, not live threads."
      },
      {
        "pattern": "agent-tools/tests/collaboration-state/**",
        "reason": "Fixture and schema-fixture estate for tests; never live state."
      }
    ],
    "migration_ledgers": []
  },
  "surface_defaults": {
    "required_contract_fields": [
      "purpose",
      "authority",
      "lifecycle",
      "writer_or_write_api",
      "entry_identity",
      "merge_class",
      "schema_or_parser",
      "generated_outputs",
      "validator",
      "severity",
      "repair_path",
      "portability_tier",
      "owner_reviewer_route"
    ],
    "stored_derived_values_rule": "Allowed only when the validator recomputes and compares them.",
    "repair_preservation_rule": "Do not delete, trim, or compress knowledge to satisfy fitness."
  },
  "surfaces": [
    {
      "id": "substrate-inventory",
      "path": ".agent/memory/executive/memory-state-substrate-contracts.md",
      "plane": "memory",
      "purpose": "Human-facing host-local substrate contract and index for state, memory, generated read models, historical roots, and repair routing.",
      "authority": [
        "PDR-050-state-memory-substrate-contracts",
        "PDR-049-memory-and-state-file-merge-semantics"
      ],
      "lifecycle": "live contract",
      "writer_or_write_api": "Human edit through substrate-contract adoption, consolidation, or transplant-plan implementation.",
      "entry_identity": "single file path plus strict manifest contract_version",
      "merge_class": "index-narrative-tables",
      "schema_or_parser": ".agent/memory/executive/memory-state-substrate-contracts.manifest.json validated by .agent/memory/executive/memory-state-substrate-contracts.schema.json",
      "generated_outputs": [
        ".agent/memory/executive/memory-state-substrate-contracts.manifest.json"
      ],
      "validator": "strict manifest schema validation by the practice-substrate evaluator (pnpm --filter @engraph/agent-tools practice-substrate -- check)",
      "severity": [
        {
          "invariant": "manifest JSON invalid",
          "severity": "blocking"
        },
        {
          "invariant": "manifest omits a required surface contract field",
          "severity": "blocking"
        },
        {
          "invariant": "human Markdown and strict manifest disagree semantically",
          "severity": "review-required"
        }
      ],
      "repair_path": [
        {
          "action": "regenerate strict manifest from reviewed human contract",
          "repair_class": "deterministic"
        },
        {
          "action": "edit human contract and manifest together with reviewer evidence",
          "repair_class": "manual-with-provenance"
        },
        {
          "action": "delete contract content to satisfy fitness",
          "repair_class": "forbidden"
        }
      ],
      "portability_tier": "host-bridge",
      "owner_reviewer_route": "docs-adr-expert + assumptions-expert + architecture-expert; owner for contract-version changes"
    },
    {
      "id": "state-entrypoint",
      "path": ".agent/state/README.md",
      "plane": "state",
      "purpose": "Entry point for live and historical Practice state surfaces and their canonical communication-event root.",
      "authority": [
        "PDR-050-state-memory-substrate-contracts",
        "PDR-049-memory-and-state-file-merge-semantics"
      ],
      "lifecycle": "live entrypoint",
      "writer_or_write_api": "Human edit when state topology changes.",
      "entry_identity": "single file path",
      "merge_class": "index-narrative-tables",
      "schema_or_parser": "Markdown frontmatter plus section conventions",
      "generated_outputs": [],
      "validator": "markdownlint/prettier plus practice-substrate evaluator",
      "severity": [
        {
          "invariant": "entrypoint names a retired root as live",
          "severity": "blocking"
        },
        {
          "invariant": "entrypoint omits canonical live state roots",
          "severity": "blocking"
        },
        {
          "invariant": "entrypoint route is stale but non-authoritative",
          "severity": "review-required"
        }
      ],
      "repair_path": [
        {
          "action": "replace stale live-path references after classification",
          "repair_class": "deterministic"
        },
        {
          "action": "classify ambiguous archived references before editing",
          "repair_class": "manual-with-provenance"
        },
        {
          "action": "rewrite archived evidence to current truth",
          "repair_class": "forbidden"
        }
      ],
      "portability_tier": "repo-local-contract",
      "owner_reviewer_route": "architecture-expert + docs-adr-expert; owner for state-topology changes",
      "notes": "Phase-8 forward-reference: .agent/state/ is not yet materialised in castr; the contract describes the intended state-plane entrypoint."
    },
    {
      "id": "collaboration-comms-events",
      "path": ".agent/state/collaboration/comms/",
      "plane": "state",
      "purpose": "Canonical live immutable communication-event fragments that render to the shared communication log.",
      "authority": [
        "PDR-050-state-memory-substrate-contracts",
        "PDR-049-memory-and-state-file-merge-semantics"
      ],
      "lifecycle": "live immutable fragments",
      "writer_or_write_api": "pnpm agent-tools:collaboration-state -- comms send",
      "entry_identity": "event JSON filename and event_id",
      "merge_class": "exclusive-create-fragments",
      "schema_or_parser": "agent-tools collaboration-state comms parser plus JSON Schema at agent-tools/src/collaboration-state/schemas/comms-event.schema.json (committed source, WS7-decoupled from the data plane); the runtime .agent/state/collaboration/comms/ event data is a Phase-8 item",
      "generated_outputs": [".agent/state/collaboration/shared-comms-log.md"],
      "validator": "pnpm agent-tools:collaboration-state -- check --comms-dir .agent/state/collaboration/comms; practice-substrate drift comparison",
      "severity": [
        {
          "invariant": "invalid event JSON",
          "severity": "blocking"
        },
        {
          "invariant": "new event written outside canonical root",
          "severity": "blocking"
        },
        {
          "invariant": "generated log drift after renderer contract exists",
          "severity": "blocking"
        },
        {
          "invariant": "malformed event body requiring provenance-preserving repair",
          "severity": "review-required"
        }
      ],
      "repair_path": [
        {
          "action": "regenerate shared communication log from canonical events",
          "repair_class": "deterministic"
        },
        {
          "action": "repair malformed event only with original content preserved",
          "repair_class": "manual-with-provenance"
        },
        {